{
  "report": "capt-boot-report",
  "schema": "capt-core-runtime/boot-report/v1",
  "generated_at": "2026-08-01T02:57:39Z",
  "workspace_root": "/tmp/capt-adv-F.dTaT4L/ws",
  "branch": "main",
  "head": "0ed77368d8ea4e227876815cb25b9c9a852ceeae",
  "dirty": true,
  "python": {
    "version": "3.12.13",
    "executable": "/Users/knowurknot/capt-solo/.venv/bin/python"
  },
  "capt": {
    "module_file": "/Users/knowurknot/capt-solo/capt_solo/__init__.py",
    "version": "0.5.0",
    "cwd_shadowing_module": "/Users/knowurknot/capt-core-skill-worktree/capt_solo/__init__.py",
    "home": "/tmp/capt-adv-F.dTaT4L/home"
  },
  "mission_id": "mission-skill-real-acceptance",
  "session_id": "cd662ceae4c84191b6976168b81b97e0",
  "checkpoint_id": "mission-skill-real-acceptance@PHASE_ACCEPTANCE",
  "active_directive_ids": [],
  "superseded_directive_ids": [],
  "selected_memory_ids": [
    "4b5597bf4a9d4731bfd3814ae8cf6e39"
  ],
  "rejected_memory_ids": [
    "c9c1df2139b8495bb9f8c020a5ba92a0"
  ],
  "missing_memory_ids": [
    "624c6d95fca14afd932048a6df15ca3c"
  ],
  "conflict_ids": [
    "dfcc081b156b4d1ea8f16f53b598ff9a"
  ],
  "stale_memory_ids": [
    "bc9db288103943e7b5179c71c30f40ae"
  ],
  "intent_id": "intent-0a5b7bcea7d9700e",
  "contextpack_digest": "sha256:35f4ffed2f84bda59b1227c1da081932b3597be3d6b505166bedd00ec5881777",
  "memory_use_decision_id": "6bedd00ec5881777",
  "gate_result": "PASS",
  "capt_execution_mode": "GOVERNED",
  "hermes_session_mode": "BOOTSTRAP_DEGRADED",
  "hermes_session_mode_reason": "Hermes tool hooks are observational; model-facing context equality with the ContextPack is unverified",
  "block_reason": "",
  "block_codes": [],
  "next_justified_action": "verify",
  "latest_verified_milestone": "NOT_ASSERTED (read from checkpoint phase / repository evidence)",
  "boot_trace_artifact": "/tmp/capt-adv-F.dTaT4L/home/data/evidence/agent-boot/agentrun-60bfc52a04184216.json",
  "boot_trace_artifact_hash": "sha256:77e406736832ffe6818d62755d735c7344dd333d0413e0dcc38740a3cdcf1501",
  "boot_trace_match": "contextpack_digest",
  "agent_run_id": "agentrun-60bfc52a04184216"
}
