{
  "report": "capt-boot-report",
  "schema": "capt-core-runtime/boot-report/v1",
  "generated_at": "2026-08-01T03:39:34Z",
  "workspace_root": "/tmp/capt-skill-acceptance.McHDHl/ws",
  "branch": "main",
  "head": "026c45997e02e3c0d58a3846ea679bd17e4a6e8c",
  "dirty": true,
  "python": {
    "version": "3.12.13",
    "executable": "/Users/knowurknot/capt-solo/.venv/bin/python"
  },
  "capt": {
    "module_file": "/Users/knowurknot/capt-solo/capt_solo/__init__.py",
    "version": "0.5.0",
    "cwd_shadowing_module": "/Users/knowurknot/capt-core-skill-worktree/capt_solo/__init__.py",
    "home": "/tmp/capt-skill-acceptance.McHDHl/home"
  },
  "mission_id": "mission-skill-real-acceptance",
  "session_id": "ca13d4dbce9646d3816c8ab207833dd5",
  "checkpoint_id": "mission-skill-real-acceptance@PHASE_ACCEPTANCE",
  "active_directive_ids": [],
  "superseded_directive_ids": [],
  "selected_memory_ids": [
    "8fdb34facaa24b3491566161261dd0ad",
    "86b60cbd59794dc2ad467426921725b3"
  ],
  "rejected_memory_ids": [
    "cca99d48e2304c1ba0c434e7da3f0023",
    "28d47ef789154e25bcfa935a48809452"
  ],
  "missing_memory_ids": [
    "1873c502c3a34a3cb7c79ebfd9926522",
    "e48fee2ae9d64f539045c70abfbd3c84"
  ],
  "conflict_ids": [
    "c8892664fa1c46858a90755557c0d6cf",
    "63d04c07dcce4739bd9c73837d2f3354"
  ],
  "stale_memory_ids": [
    "6e181409f1ab489da914584535d1bdc6",
    "ca9619ba4fe242ad8933d334f23763b7"
  ],
  "intent_id": "intent-219715a73034f8ab",
  "contextpack_digest": "sha256:fcf6d22c1537e19db11c9ea63a143ee3573dd4c946dcc7589f95c2481dff7b15",
  "memory_use_decision_id": "9f95c2481dff7b15",
  "gate_result": "PASS",
  "capt_execution_mode": "GOVERNED",
  "hermes_session_mode": "BOOTSTRAP_DEGRADED",
  "hermes_session_mode_reason": "Hermes tool hooks are observational; model-facing context equality with the ContextPack is unverified",
  "block_reason": "",
  "block_codes": [],
  "next_justified_action": "verify boot report",
  "latest_verified_milestone": "NOT_ASSERTED (read from checkpoint phase / repository evidence)",
  "boot_trace_artifact": "/tmp/capt-skill-acceptance.McHDHl/home/data/evidence/agent-boot/agentrun-7e170b3b08344000.json",
  "boot_trace_artifact_hash": "sha256:1209f55618626001cfcfda1c112b05592ee3b74b69495d513ea0f0ea93f5dfa6",
  "boot_trace_match": "contextpack_digest",
  "agent_run_id": "agentrun-7e170b3b08344000"
}
