{
  "report": "capt-boot-report",
  "schema": "capt-core-runtime/boot-report/v1",
  "generated_at": "2026-08-01T02:26:38Z",
  "workspace_root": "/tmp/capt-skill-acceptance.Fsp3xv/ws",
  "branch": "main",
  "head": "f2eb81ee3286c5d5369ca85155f2984ffa7bd68d",
  "dirty": true,
  "python": {
    "version": "3.12.13",
    "executable": "/Users/knowurknot/capt-solo/.venv/bin/python"
  },
  "capt": {
    "module_file": "/Users/knowurknot/capt-solo/capt_solo/__init__.py",
    "version": "0.5.0",
    "home": "/tmp/capt-skill-acceptance.Fsp3xv/home"
  },
  "mission_id": "mission-skill-real-acceptance",
  "session_id": "6e4a3092c65f46d1b11ed1df1761d99d",
  "checkpoint_id": "mission-skill-real-acceptance@PHASE_ACCEPTANCE",
  "active_directive_ids": [],
  "superseded_directive_ids": [],
  "selected_memory_ids": [
    "9412f76d322f4d1d81514874d36fca98",
    "bffdd612021e4b37beb8495fe3395099"
  ],
  "rejected_memory_ids": [
    "855e4faac7984effb81c3739763df455",
    "4ad6da75514a4f9898cd7ccb56e311c2"
  ],
  "missing_memory_ids": [
    "80d43ff358744b8bbdec53f6473b22d4",
    "8dd09c040dfa402e8730f7f1917423aa"
  ],
  "conflict_ids": [
    "f5f90ce7c33a4c7ba27a593aac101f00",
    "1444ee425c674e9c989e802e3e41fd32"
  ],
  "stale_memory_ids": [
    "0bcef5d930334f0e8018afea445b29a6",
    "b700de6028c344418753f9fddec81c21"
  ],
  "intent_id": "intent-cd6d4c8c550b559b",
  "contextpack_digest": "sha256:49f6eb146715ef8ce928bcc53e289f212f5d31ed200aa58d5d083449ecf591c5",
  "memory_use_decision_id": "5d083449ecf591c5",
  "gate_result": "PASS",
  "capt_execution_mode": "GOVERNED",
  "hermes_session_mode": "BOOTSTRAP_DEGRADED",
  "hermes_session_mode_reason": "Hermes tool hooks are observational; model-facing context equality with the ContextPack is unverified",
  "block_reason": "",
  "block_codes": [],
  "next_justified_action": "verify boot report",
  "latest_verified_milestone": "NOT_ASSERTED (read from checkpoint phase / repository evidence)",
  "boot_trace_artifact": "/tmp/capt-skill-acceptance.Fsp3xv/home/data/evidence/agent-boot/agentrun-d755e3287a4e4bed.json",
  "boot_trace_artifact_hash": "sha256:6a4d92b23b48423774f1bddad9e7437318b47997a15f747fe469520d7ff18a84",
  "boot_trace_match": "contextpack_digest",
  "agent_run_id": "agentrun-d755e3287a4e4bed"
}
