{
  "report": "capt-boot-report",
  "schema": "capt-core-runtime/boot-report/v1",
  "generated_at": "2026-08-01T03:40:04Z",
  "workspace_root": "/tmp/capt-replay-origin.9GZiRq/ws",
  "branch": "main",
  "head": "cbac78cb8ffaef6fbd4b515e0813b04c53cae557",
  "dirty": true,
  "python": {
    "version": "3.12.13",
    "executable": "/Users/knowurknot/capt-solo/.venv/bin/python"
  },
  "capt": {
    "module_file": "/Users/knowurknot/capt-solo/capt_solo/__init__.py",
    "version": "0.5.0",
    "cwd_shadowing_module": "/Users/knowurknot/capt-core-skill-worktree/capt_solo/__init__.py",
    "home": "/tmp/capt-replay-origin.9GZiRq/home"
  },
  "mission_id": "mission-external-replay",
  "session_id": "8ae3dd35616b428dbb15060850975d85",
  "checkpoint_id": "mission-external-replay@PHASE_EXTERNAL_REPLAY",
  "active_directive_ids": [],
  "superseded_directive_ids": [],
  "selected_memory_ids": [
    "63aedb09e0bc42769ad60f8be44f7c1d"
  ],
  "rejected_memory_ids": [
    "f2d74e9cb715401db0bacedd0bbd2a28"
  ],
  "missing_memory_ids": [
    "ff5b5b02a0bc412384906954c05e9cec"
  ],
  "conflict_ids": [
    "9cac710b18044b4ebce49cac8c18ea69"
  ],
  "stale_memory_ids": [
    "d0c6e6b3d960441e9da30c88adc65b44"
  ],
  "intent_id": "intent-ed3e51f7f386d4aa",
  "contextpack_digest": "sha256:2ce006b1fe6a990d1f95e96b6246b36f3a24bfeb1fa1df5b76223520e57e387d",
  "memory_use_decision_id": "76223520e57e387d",
  "gate_result": "PASS",
  "capt_execution_mode": "GOVERNED",
  "hermes_session_mode": "BOOTSTRAP_DEGRADED",
  "hermes_session_mode_reason": "Hermes tool hooks are observational; model-facing context equality with the ContextPack is unverified",
  "block_reason": "",
  "block_codes": [],
  "next_justified_action": "verify replay continuity",
  "latest_verified_milestone": "NOT_ASSERTED (read from checkpoint phase / repository evidence)",
  "boot_trace_artifact": "/tmp/capt-replay-origin.9GZiRq/home/data/evidence/agent-boot/agentrun-dcccbb83aa434dc7.json",
  "boot_trace_artifact_hash": "sha256:0609248ac53a89517be149ba4f7f84abb9739791211e39262cb5d751ebbe8812",
  "boot_trace_match": "contextpack_digest",
  "agent_run_id": "agentrun-dcccbb83aa434dc7"
}
