{
  "report": "capt-boot-report",
  "schema": "capt-core-runtime/boot-report/v1",
  "generated_at": "2026-08-01T03:39:47Z",
  "workspace_root": "/tmp/capt-adv-F.os0Cnz/ws",
  "branch": "main",
  "head": "97d1c5393d34a682da7f5a7cb3ff3dca2268247c",
  "dirty": true,
  "python": {
    "version": "3.12.13",
    "executable": "/Users/knowurknot/capt-solo/.venv/bin/python"
  },
  "capt": {
    "module_file": "/Users/knowurknot/capt-solo/capt_solo/__init__.py",
    "version": "0.5.0",
    "cwd_shadowing_module": "/Users/knowurknot/capt-core-skill-worktree/capt_solo/__init__.py",
    "home": "/tmp/capt-adv-F.os0Cnz/home"
  },
  "mission_id": "mission-skill-real-acceptance",
  "session_id": "fc86ca4d8bfe4b38bd079588b013aef3",
  "checkpoint_id": "mission-skill-real-acceptance@PHASE_ACCEPTANCE",
  "active_directive_ids": [],
  "superseded_directive_ids": [],
  "selected_memory_ids": [
    "9b266de718de492aaf7a56d00a576c47"
  ],
  "rejected_memory_ids": [
    "7222b1fd1b0b49cd96f54b5dc0be2c82"
  ],
  "missing_memory_ids": [
    "e098cad5dcb54043a070d3b48625a555"
  ],
  "conflict_ids": [
    "97020f05cc0b488698535e14be59b1c8"
  ],
  "stale_memory_ids": [
    "eb1e8810d5d74538b97f6c6cbfe13cf3"
  ],
  "intent_id": "intent-379402281aa1d7a7",
  "contextpack_digest": "sha256:323ffa00f74eb1443d42a844c3ebd2146223e87084e426fc96698af7d7e2e874",
  "memory_use_decision_id": "96698af7d7e2e874",
  "gate_result": "PASS",
  "capt_execution_mode": "GOVERNED",
  "hermes_session_mode": "BOOTSTRAP_DEGRADED",
  "hermes_session_mode_reason": "Hermes tool hooks are observational; model-facing context equality with the ContextPack is unverified",
  "block_reason": "",
  "block_codes": [],
  "next_justified_action": "verify",
  "latest_verified_milestone": "NOT_ASSERTED (read from checkpoint phase / repository evidence)",
  "boot_trace_artifact": "/tmp/capt-adv-F.os0Cnz/home/data/evidence/agent-boot/agentrun-365e328156ef431b.json",
  "boot_trace_artifact_hash": "sha256:6125ed1cc1e4e4409e607af2bde8a734058f45e093daf6400fab3c5b4e50a94e",
  "boot_trace_match": "contextpack_digest",
  "agent_run_id": "agentrun-365e328156ef431b"
}
